{
  "schema_version": 1,
  "generated_at_utc": "2026-07-23T22:40:43.370Z",
  "producer": {
    "name": "codex-local-domain-model",
    "version": "0.1.0.dev0",
    "build_id": "milestone2-local-20260724"
  },
  "status": "passed",
  "suite": {
    "id": "milestone2-local",
    "name": "Milestone 2 local domain model and contracts",
    "run_id": "20260724-local-002",
    "command": "See docs/test-reports/2026-07-24-milestone2-local.md",
    "tags": ["local", "domain-model", "bounded-input"]
  },
  "summary": {
    "duration_ms": 113800,
    "total": 9,
    "passed": 9,
    "failed": 0,
    "errored": 0,
    "skipped": 0
  },
  "cases": [
    {
      "id": "lock",
      "name": "uv lockfile synchronization",
      "status": "passed",
      "duration_ms": 0
    },
    {
      "id": "format",
      "name": "Ruff formatting",
      "status": "passed",
      "duration_ms": 0
    },
    {
      "id": "lint",
      "name": "Ruff lint",
      "status": "passed",
      "duration_ms": 0
    },
    {
      "id": "mypy",
      "name": "Strict mypy",
      "status": "passed",
      "duration_ms": 0
    },
    {
      "id": "pytest-py311",
      "name": "172 tests on Python 3.11",
      "status": "passed",
      "duration_ms": 18650
    },
    {
      "id": "pytest-py312",
      "name": "172 tests on Python 3.12",
      "status": "passed",
      "duration_ms": 14680
    },
    {
      "id": "pytest-py313",
      "name": "172 tests on Python 3.13",
      "status": "passed",
      "duration_ms": 14980
    },
    {
      "id": "sidecar-schema",
      "name": "Sidecar JSON Schema and canonical documents",
      "status": "passed",
      "duration_ms": 0
    },
    {
      "id": "build",
      "name": "Source distribution and wheel build",
      "status": "passed",
      "duration_ms": 0
    }
  ],
  "evidence_artifacts": [
    {
      "path": "docs/test-reports/2026-07-24-milestone2-local.md",
      "kind": "text",
      "description": "Human-readable scope, commands, results, and hardware limitations"
    },
    {
      "path": "schemas/clip-sidecar-v1.schema.json",
      "kind": "json",
      "description": "Version 1 portable clip-sidecar contract"
    }
  ],
  "measurements": [
    {
      "name": "unit_tests_per_interpreter",
      "value": 172,
      "unit": "tests"
    },
    {
      "name": "python_interpreters_tested",
      "value": 3,
      "unit": "interpreters"
    }
  ],
  "warnings": [
    {
      "code": "LOCAL_ONLY",
      "message": "No Raspberry Pi, attached device, filesystem durability, or media performance claim was evaluated."
    }
  ],
  "environment": {
    "kind": "local",
    "os": "Microsoft Windows 11 Pro",
    "os_version": "10.0.26200",
    "architecture": "AMD64",
    "python_version": "3.12.6",
    "machine_class": "development-workstation"
  }
}
